{
  "$ref": "#/definitions/landings",
  "definitions": {
    "landings": {
      "type": "object",
      "properties": {
        "locale": {
          "type": "string"
        },
        "slug": {
          "type": "string"
        },
        "meta": {
          "type": "object",
          "properties": {
            "active": {
              "type": "string"
            },
            "headerCtaHref": {
              "type": "string"
            },
            "structuredData": {
              "type": "object",
              "additionalProperties": {}
            },
            "title": {
              "type": "string"
            },
            "description": {
              "type": "string"
            },
            "image": {
              "type": "string"
            }
          },
          "required": [
            "title"
          ],
          "additionalProperties": false
        },
        "sections": {
          "type": "array",
          "items": {
            "type": "object",
            "properties": {
              "type": {
                "type": "string",
                "enum": [
                  "Hero",
                  "Pains",
                  "Features",
                  "HowItWorks",
                  "Products",
                  "Testimonials",
                  "Pricing",
                  "FAQ",
                  "CTA"
                ]
              },
              "props": {}
            },
            "required": [
              "type"
            ],
            "additionalProperties": false
          }
        },
        "$schema": {
          "type": "string"
        }
      },
      "required": [
        "locale",
        "slug",
        "meta",
        "sections"
      ],
      "additionalProperties": false
    }
  },
  "$schema": "http://json-schema.org/draft-07/schema#"
}