{
  "locale": "pt",
  "slug": "quizbee-base",
  "meta": {
    "title": "QuizBee - Aprenda de Forma Mais Inteligente com Quizzes Alimentados por IA",
    "description": "Transforme seus materiais de estudo em questionários interativos alimentados por IA. Aprendizado adaptativo, tutoria com IA e rastreamento de progresso para alunos e profissionais.",
    "image": "/bee_v3.svg",
    "active": "home",
    "headerCtaHref": "{{APP_URL}}",
    "structuredData": {
      "@context": "https://schema.org",
      "@type": "WebApplication",
      "name": "QuizBee",
      "description": "Plataforma de geração de questionários alimentada por IA que transforma materiais de estudo em quizzes interativos",
      "applicationCategory": "EducationalApplication",
      "offers": {
        "@type": "Offer",
        "price": "0",
        "priceCurrency": "USD"
      },
      "aggregateRating": {
        "@type": "AggregateRating",
        "ratingValue": "5",
        "ratingCount": "6",
        "reviewCount": "6"
      }
    }
  },
  "sections": [
    {
      "type": "Hero",
      "props": {
        "title": "Passe nos Seus Exames",
        "titleHighlight": "Sem Estresse e Incerteza",
        "description": "Carregue suas notas de aula, livros didáticos ou guias de estudo. QuizBee usa IA para gerar questionários personalizados que ajudam você a passar em seus testes e exames.",
        "buttonText": "Comece Sua Preparação Agora",
        "footerText": "Grátis para começar • Nenhum cartão de crédito necessário",
        "href": "{{APP_URL}}",
        "image": "",
        "titleAlign": "center",
        "descriptionAlign": "center",
        "footerAlign": "center",
        "position": "right",
        "center": true,
        "textWidth": "max-w-5xl",
        "titleSize": "text-7xl 2xl:text-8xl",
        "descriptionSize": "text-xl 2xl:text-2xl py-6",
        "buttonSize": "xl"
      }
    },
    {
      "type": "Pains",
      "props": {
        "title": "Cansado de Estudar e Não Reter Nada?",
        "theme": "",
        "pains": [
          {
            "title": "Você Lê… e Esquece",
            "description": "Você passa horas relendo, mas quando chega o exame, tudo desaparece de sua memória.",
            "icon": "book-open-text"
          },
          {
            "title": "Trabalho Árduo, Resultados Incertos",
            "description": "Você estuda muito, mas antes da prova você não sabe o que revisar ou o que perdeu.",
            "icon": "frown"
          },
          {
            "title": "Materiais em Todo Lugar, Sem Estrutura",
            "description": "Toneladas de PDFs, slides de aula, notas, mas nenhuma maneira de transformá-los em algo útil para aprender de verdade.",
            "icon": "file-stack"
          },
          {
            "title": "Cansado de Chats de IA Infinitos",
            "description": "Cansado de carregar e re-explicar o mesmo conteúdo repetidamente para chats de IA?",
            "icon": "message-circle-x"
          }
        ]
      }
    },
    {
      "type": "Features",
      "props": {
        "title": "Recursos Poderosos para Aprendizado Mais Inteligente",
        "subtitle": "O Que Torna QuizBee Especial",
        "theme": "default",
        "features": [
          {
            "title": "Questionários Gerados por IA",
            "description": "Carregue seus materiais de estudo e obtenha instantaneamente questionários personalizados adaptados ao seu conteúdo. PDFs, documentos, notas - nós lidamos com tudo.",
            "icon": "bot"
          },
          {
            "title": "Conversas com Tutor de IA",
            "description": "Após cada pergunta, converse com um tutor de IA que conhece seus materiais. Obtenha explicações, esclarecimentos e insights mais profundos instantaneamente.",
            "icon": "message-circle"
          },
          {
            "title": "Ajuste Dinâmico de Dificuldade",
            "description": "Controle a dificuldade em tempo real enquanto faz os questionários. Muito fácil? Aumente. Muito difícil? Diminua. O questionário se adapta ao seu ritmo de aprendizado.",
            "icon": "sliders-horizontal"
          },
          {
            "title": "Refinamento de Tópicos",
            "description": "Ajuste o foco do seu questionário no meio da sessão. Quer aprofundar em um tópico específico? Apenas peça, e o questionário se adapta.",
            "icon": "target"
          },
          {
            "title": "Rastreamento de Progresso",
            "description": "Monitore seu desempenho ao longo do tempo. Veja quais tópicos você dominou e quais precisam de mais atenção.",
            "icon": "trending-up"
          },
          {
            "title": "Compartilhe e Estude Juntos",
            "description": "Compartilhe seus questionários personalizados com amigos e colegas. Estudem juntos, desafiem-se mutuamente e dominem seus assuntos em equipe.",
            "icon": "users"
          }
        ],
        "stats": {
          "total": "200+",
          "label": "Questionários Gerados Diariamente",
          "description": "Junte-se a centenas de estudantes e profissionais usando QuizBee para dominar seus materiais"
        }
      }
    },
    {
      "type": "HowItWorks",
      "props": {
        "title": "Comece em 4 Passos Simples",
        "subtitle": "Como QuizBee Funciona",
        "theme": "",
        "steps": [
          {
            "number": 1,
            "title": "Carregue Seus Materiais",
            "description": "Solte seus PDFs, documentos ou notas no QuizBee. Nossa IA analisa o conteúdo e se prepara para criar questionários personalizados baseados em seus materiais."
          },
          {
            "number": 2,
            "title": "Faça Questionários Adaptativos",
            "description": "Comece seu questionário e ajuste a dificuldade em tempo real. Refine tópicos, mude a complexidade e aprenda no seu próprio ritmo. Cada pergunta é gerada com base em seus materiais de estudo reais."
          },
          {
            "number": 3,
            "title": "Aprenda com Tutoria de IA",
            "description": "Preso em uma pergunta? Inicie uma conversa com seu tutor de IA. Obtenha explicações detalhadas, explore conceitos relacionados e realmente compreenda o material - não apenas memorize as respostas."
          },
          {
            "number": 4,
            "title": "Cresça ao Longo do Tempo",
            "description": "QuizBee aprende com sua jornada. À medida que você progride, identifica seus pontos fracos e lacunas de conhecimento, adaptando futuras perguntas para se concentrar em áreas que precisam melhorar. Construa domínio duradouro através de reforço contínuo e personalizado."
          }
        ]
      }
    },
    {
      "type": "FAQ",
      "props": {
        "title": "Perguntas Frequentes",
        "subtitle": "Tem Alguma Pergunta?",
        "theme": "",
        "questions": [
          {
            "question": "Existe um nível gratuito?",
            "answer": "Sim. Oferecemos um nível gratuito com recursos limitados para ajudá-lo a começar. Se você quiser experimentar os níveis Plus ou Pro, você sempre pode obter um reembolso dentro de 14 dias da compra."
          },
          {
            "question": "Como minhas informações de pagamento são tratadas?",
            "answer": "Suas informações de cartão de crédito são processadas inteiramente pelo Stripe, uma plataforma de pagamento altamente confiável e segura. Nunca temos acesso aos detalhes do seu cartão."
          },
          {
            "question": "Quais formatos de arquivo vocês suportam?",
            "answer": "Suportamos PDF, DOCX, PPTX, Markdown, TXT e muito mais. Você pode fazer upload de notas de aula, livros didáticos, guias de estudo, artigos - praticamente qualquer material de estudo baseado em texto."
          },
          {
            "question": "Como o tutor de IA funciona?",
            "answer": "Após cada pergunta do quiz, você pode iniciar uma conversa com nosso tutor de IA. Ele tem contexto completo de seus materiais de estudo e pode explicar conceitos, fornecer exemplos, esclarecer tópicos confusos e responder perguntas de acompanhamento - tudo baseado em SEUS materiais específicos."
          },
          {
            "question": "Meus dados são seguros e privados?",
            "answer": "Absolutamente. Seus materiais de estudo e histórico de quizzes são criptografados com AES-256 e armazenados com segurança. Como uma empresa sediada na Europa, seguimos rigorosamente a LGPD. Nunca compartilhamos seus dados para usos não autorizados - você os possui e pode deletá-los a qualquer momento."
          },
          {
            "question": "Posso cancelar minha inscrição a qualquer momento?",
            "answer": "Sim! Sem contratos de longo prazo ou compromissos. Cancele com um clique nas configurações da sua conta. Você manterá acesso até o final de seu período de faturamento, e oferecemos uma garantia de reembolso de 14 dias."
          }
        ]
      }
    },
    {
      "type": "CTA",
      "props": {
        "headline": "Pronto para Transformar Seu Aprendizado?",
        "subheadline": "Junte-se a centenas de estudantes que estão aprendendo de forma mais inteligente com quizzes alimentados por IA. Faça upload do seu primeiro material e crie um quiz em segundos. Nenhum cartão de crédito necessário.",
        "buttonText": "Começar Grátis - Nenhum Cartão de Crédito Necessário",
        "buttonHref": "{{APP_URL}}",
        "theme": ""
      }
    }
  ]
}
