{
  "locale": "fr",
  "slug": "quizbee-base",
  "meta": {
    "title": "QuizBee - Apprenez Plus Intelligemment avec des Quiz Alimentés par l'IA",
    "description": "Transformez vos supports d'étude en quiz interactifs alimentés par l'IA. Apprentissage adaptatif, tutorat IA et suivi de progrès pour les étudiants et les professionnels.",
    "image": "/bee_v3.svg",
    "active": "home",
    "headerCtaHref": "{{APP_URL}}",
    "structuredData": {
      "@context": "https://schema.org",
      "@type": "WebApplication",
      "name": "QuizBee",
      "description": "Plateforme de génération de quiz alimentée par l'IA qui transforme les supports d'étude en quiz interactifs",
      "applicationCategory": "EducationalApplication",
      "offers": {
        "@type": "Offer",
        "price": "0",
        "priceCurrency": "USD"
      },
      "aggregateRating": {
        "@type": "AggregateRating",
        "ratingValue": "5",
        "ratingCount": "6",
        "reviewCount": "6"
      }
    }
  },
  "sections": [
    {
      "type": "Hero",
      "props": {
        "title": "Transformez Vos Supports d'Étude en",
        "titleHighlight": "Quiz Interactifs",
        "description": "Téléchargez vos notes de cours, vos manuels ou vos guides d'étude. QuizBee utilise l'IA pour générer des quiz personnalisés qui vous aident à réussir vos examens.",
        "buttonText": "Commencez à créer des quiz",
        "footerText": "Gratuit pour commencer • Aucune carte de crédit requise",
        "href": "{{APP_URL}}",
        "image": "",
        "titleAlign": "center",
        "descriptionAlign": "center",
        "footerAlign": "center",
        "position": "right",
        "center": true,
        "textWidth": "max-w-5xl",
        "titleSize": "text-7xl 2xl:text-8xl",
        "descriptionSize": "text-xl 2xl:text-2xl py-6",
        "buttonSize": "xl"
      }
    },
    {
      "type": "Pains",
      "props": {
        "title": "Vous en Avez Marre d'Étudier Sans Rien Retenir?",
        "theme": "",
        "pains": [
          {
            "title": "Vous Lisez… et Oubliez",
            "description": "Vous passez des heures à relire, mais quand vient l'examen, tout disparaît de votre mémoire.",
            "icon": "book-open-text"
          },
          {
            "title": "Travail Acharné, Résultats Incertains",
            "description": "Vous travaillez dur, mais avant l'examen, vous ne savez pas quoi réviser ni ce que vous avez manqué.",
            "icon": "frown"
          },
          {
            "title": "Supports Partout, Aucune Structure",
            "description": "Des tonnes de PDFs, de diapositives de cours, de notes, mais aucun moyen de les transformer en quelque chose d'utile pour vraiment apprendre.",
            "icon": "file-stack"
          },
          {
            "title": "Fatigué des Chats IA Infinis",
            "description": "Fatigué de télécharger et de réexpliquer le même contenu encore et encore à des chats IA?",
            "icon": "message-circle-x"
          }
        ]
      }
    },
    {
      "type": "Features",
      "props": {
        "title": "Fonctionnalités Puissantes pour un Apprentissage Plus Intelligent",
        "subtitle": "Ce Qui Rend QuizBee Spécial",
        "theme": "default",
        "features": [
          {
            "title": "Quiz Générés par l'IA",
            "description": "Téléchargez vos supports d'étude et obtenez instantáneement des quiz personnalisés adaptés à votre contenu. PDFs, documents, notes - nous gérons tout.",
            "icon": "bot"
          },
          {
            "title": "Conversations avec Tuteur IA",
            "description": "Après chaque question, discutez avec un tuteur IA qui connaît vos supports. Obtenez des explications, des clarifications et des insights plus profonds instantanément.",
            "icon": "message-circle"
          },
          {
            "title": "Ajustement Dynamique de la Difficulté",
            "description": "Contrôlez la difficulté en temps réel pendant que vous passez les quiz. Trop facile? Augmentez. Trop difficile? Réduisez. Le quiz s'adapte à votre rythme d'apprentissage.",
            "icon": "sliders-horizontal"
          },
          {
            "title": "Affinement des Sujets",
            "description": "Ajustez le focus de votre quiz en cours de session. Vous voulez approfondir un sujet spécifique? Demandez simplement, et le quiz s'adapte.",
            "icon": "target"
          },
          {
            "title": "Suivi des Progrès",
            "description": "Surveillez vos performances au fil du temps. Voyez quels sujets vous avez maîtrisés et lesquels nécessitent plus d'attention.",
            "icon": "trending-up"
          },
          {
            "title": "Partagez et Étudiez Ensemble",
            "description": "Partagez vos quiz personnalisés avec vos amis et vos camarades. Étudiez ensemble, défiez-vous mutuellement et maîtrisez vos sujets en équipe.",
            "icon": "users"
          }
        ],
        "stats": {
          "total": "200+",
          "label": "Quiz Générés Quotidiennement",
          "description": "Rejoignez des centaines d'étudiants et de professionnels utilisant QuizBee pour maîtriser leurs supports"
        }
      }
    },
    {
      "type": "HowItWorks",
      "props": {
        "title": "Commencez en 4 Étapes Simples",
        "subtitle": "Comment Fonctionne QuizBee",
        "theme": "",
        "steps": [
          {
            "number": 1,
            "title": "Téléchargez Vos Supports",
            "description": "Déposez vos PDFs, documents ou notes dans QuizBee. Notre IA analyse le contenu et se prépare à créer des quiz personnalisés basés sur vos supports."
          },
          {
            "number": 2,
            "title": "Passez des Quiz Adaptatifs",
            "description": "Commencez votre quiz et ajustez la difficulté à la volée. Affinez les sujets, changez la complexité et apprenez à votre propre rythme. Chaque question est générée en fonction de vos supports d'étude réels."
          },
          {
            "number": 3,
            "title": "Apprenez avec le Tutorat IA",
            "description": "Bloqué sur une question? Lancez une conversation avec votre tuteur IA. Obtenez des explications détaillées, explorez des concepts connexes et comprenez vraiment le matériel - pas seulement mémoriser les réponses."
          },
          {
            "number": 4,
            "title": "Grandir au Fil du Temps",
            "description": "QuizBee apprend de votre parcours. Au fur et à mesure de votre progression, il identifie vos points faibles et les lacunes de vos connaissances, en adaptant les futures questions pour se concentrer sur les domaines qui nécessitent une amélioration. Construisez une maîtrise durable grâce à un renforcement continu et personnalisé."
          }
        ]
      }
    },
    {
      "type": "FAQ",
      "props": {
        "title": "Questions Fréquemment Posées",
        "subtitle": "Avez-Vous des Questions?",
        "theme": "",
        "questions": [
          {
            "question": "Y a-t-il un niveau gratuit?",
            "answer": "Oui. Nous offrons un niveau gratuit avec des fonctionnalités limitées pour vous aider à démarrer. Si vous souhaitez tester les niveaux Plus ou Pro, vous pouvez toujours obtenir un remboursement dans les 14 jours suivant l'achat."
          },
          {
            "question": "Comment mes informations de paiement sont-elles traitées?",
            "answer": "Vos informations de carte de crédit sont traitées entièrement par Stripe, une plateforme de paiement hautement fiable et sécurisée. Nous n'avons jamais accès aux détails de votre carte."
          },
          {
            "question": "Quels formats de fichier supportez-vous?",
            "answer": "Nous supportons PDF, DOCX, PPTX, Markdown, TXT et plus. Vous pouvez télécharger des notes de cours, des manuels, des guides d'étude, des articles - pratiquement n'importe quel matériel d'étude basé sur du texte."
          },
          {
            "question": "Comment fonctionne le tuteur IA?",
            "answer": "Après chaque question de quiz, vous pouvez commencer une conversation avec notre tuteur IA. Il a le contexte complet de vos supports d'étude et peut expliquer des concepts, fournir des exemples, clarifier des sujets confus et répondre à des questions de suivi - tout basé sur VOS supports spécifiques."
          },
          {
            "question": "Mes données sont-elles sûres et privées?",
            "answer": "Absolument. Vos supports d'étude et votre historique de quiz sont chiffrés avec AES-256 et stockés en toute sécurité. En tant qu'entreprise basée en Europe, nous respectons strictement la RGPD. Nous ne partageons jamais vos données pour des utilisations non autorisées - vous les posséder et pouvez les supprimer à tout moment."
          },
          {
            "question": "Puis-je annuler mon abonnement à tout moment?",
            "answer": "Oui! Pas de contrats à long terme ou d'engagements. Annulez en un clic depuis les paramètres de votre compte. Vous conservez l'accès jusqu'à la fin de votre période de facturation et nous offrons une garantie de remboursement de 14 jours."
          }
        ]
      }
    },
    {
      "type": "CTA",
      "props": {
        "headline": "Prêt à Transformer Votre Apprentissage?",
        "subheadline": "Rejoignez des centaines d'étudiants qui étudient plus intelligemment avec des quiz alimentés par l'IA. Téléchargez votre premier support et créez un quiz en secondes. Aucune carte de crédit requise.",
        "buttonText": "Commencer Gratuitement - Aucune Carte de Crédit Requise",
        "buttonHref": "{{APP_URL}}",
        "theme": ""
      }
    }
  ]
}
