{
  "locale": "de",
  "slug": "quizbee-base",
  "meta": {
    "title": "QuizBee - Lernen Sie Intelligenter mit KI-gestützten Quiz",
    "description": "Verwandeln Sie Ihre Lernmaterialien in interaktive KI-gestützte Quiz. Adaptives Lernen, KI-Nachhilfe und Fortschrittsänderung für Schüler und Fachleute.",
    "image": "/bee_v3.svg",
    "active": "home",
    "headerCtaHref": "{{APP_URL}}",
    "structuredData": {
      "@context": "https://schema.org",
      "@type": "WebApplication",
      "name": "QuizBee",
      "description": "KI-gestützte Quiz-Generierungsplattform, die Lernmaterialien in interaktive Quiz umwandelt",
      "applicationCategory": "EducationalApplication",
      "offers": {
        "@type": "Offer",
        "price": "0",
        "priceCurrency": "USD"
      },
      "aggregateRating": {
        "@type": "AggregateRating",
        "ratingValue": "5",
        "ratingCount": "6",
        "reviewCount": "6"
      }
    }
  },
  "sections": [
    {
      "type": "Hero",
      "props": {
        "title": "Verwandeln Sie Ihre Lernmaterialien in",
        "titleHighlight": "Interaktive Quiz",
        "description": "Laden Sie Ihre Vorlesungsnotizen, Lehrbücher oder Lernratgeber hoch. QuizBee nutzt KI, um personalisierte Quiz zu generieren, die Ihnen bei Ihren Klausuren und Prüfungen helfen.",
        "buttonText": "Anfangen, Quiz zu erstellen",
        "footerText": "Kostenlos zu beginnen • Keine Kreditkarte erforderlich",
        "href": "{{APP_URL}}",
        "image": "",
        "titleAlign": "center",
        "descriptionAlign": "center",
        "footerAlign": "center",
        "position": "right",
        "center": true,
        "textWidth": "max-w-5xl",
        "titleSize": "text-7xl 2xl:text-8xl",
        "descriptionSize": "text-xl 2xl:text-2xl py-6",
        "buttonSize": "xl"
      }
    },
    {
      "type": "Pains",
      "props": {
        "title": "Sind Sie Es Leid, Zu Lernen, Ohne Etwas Zu Behalten?",
        "theme": "",
        "pains": [
          {
            "title": "Sie Lesen… und Vergessen",
            "description": "Sie verbringen Stunden damit, erneut zu lesen, aber wenn Prüfungen anstehen, verschwindet alles aus Ihrem Gedächtnis.",
            "icon": "book-open-text"
          },
          {
            "title": "Harte Arbeit, Unsichere Ergebnisse",
            "description": "Sie lernen hart, aber vor der Prüfung wissen Sie nicht, was Sie wiederholen sollen oder was Ihnen entgangen ist.",
            "icon": "frown"
          },
          {
            "title": "Materialien Überall, Keine Struktur",
            "description": "Unmengen von PDFs, Vorlesungsfolien, Notizen, aber keine Möglichkeit, sie in etwas Nützliches zum wirklichen Lernen umzuwandeln.",
            "icon": "file-stack"
          },
          {
            "title": "Müde Unendlicher KI-Chats",
            "description": "Müde davon, dieselben Inhalte immer wieder zu KI-Chats hochzuladen und erneut zu erklären?",
            "icon": "message-circle-x"
          }
        ]
      }
    },
    {
      "type": "Features",
      "props": {
        "title": "Leistungsstarke Funktionen für Intelligenteres Lernen",
        "subtitle": "Was QuizBee Besonders Macht",
        "theme": "default",
        "features": [
          {
            "title": "KI-Generierte Quiz",
            "description": "Laden Sie Ihre Lernmaterialien hoch und erhalten Sie sofort maßgeschneiderte Quiz, die auf Ihre Inhalte zugeschnitten sind. PDFs, Dokumente, Notizen - wir verarbeiten alles.",
            "icon": "bot"
          },
          {
            "title": "KI-Tutor-Gespräche",
            "description": "Nach jeder Frage chatten Sie mit einem KI-Tutor, der Ihre Materialien kennt. Erhalten Sie Erklärungen, Klarstellungen und tiefere Einblicke sofort.",
            "icon": "message-circle"
          },
          {
            "title": "Dynamische Schwierigkeitsanpassung",
            "description": "Steuern Sie die Schwierigkeit in Echtzeit, während Sie Quiz durchführen. Zu einfach? Erhöhen Sie. Zu schwer? Senken Sie. Das Quiz passt sich Ihrem Lerntempo an.",
            "icon": "sliders-horizontal"
          },
          {
            "title": "Themenverfeinerung",
            "description": "Passen Sie den Fokus Ihres Quiz während der Sitzung an. Möchten Sie tiefer in ein bestimmtes Thema eintauchen? Fragen Sie einfach, und das Quiz passt sich an.",
            "icon": "target"
          },
          {
            "title": "Fortschrittsverfolgung",
            "description": "Überwachen Sie Ihre Leistung im Laufe der Zeit. Sehen Sie, welche Themen Sie gemeistert haben und welche mehr Aufmerksamkeit benötigen.",
            "icon": "trending-up"
          },
          {
            "title": "Teilen und Gemeinsam Lernen",
            "description": "Teilen Sie Ihre benutzerdefinierten Quiz mit Freunden und Klassenkameraden. Lernen Sie zusammen, fordern Sie sich gegenseitig heraus und beherrschen Sie Ihre Fächer als Team.",
            "icon": "users"
          }
        ],
        "stats": {
          "total": "200+",
          "label": "Täglich Erstellte Quiz",
          "description": "Schließen Sie sich Hunderten von Studenten und Fachleuten an, die QuizBee nutzen, um ihre Materialien zu meistern"
        }
      }
    },
    {
      "type": "HowItWorks",
      "props": {
        "title": "Beginnen Sie in 4 Einfachen Schritten",
        "subtitle": "Wie QuizBee Funktioniert",
        "theme": "",
        "steps": [
          {
            "number": 1,
            "title": "Laden Sie Ihre Materialien Hoch",
            "description": "Legen Sie Ihre PDFs, Dokumente oder Notizen in QuizBee ab. Unsere KI analysiert den Inhalt und bereitet sich darauf vor, personalisierte Quiz basierend auf Ihren Materialien zu erstellen."
          },
          {
            "number": 2,
            "title": "Machen Sie Adaptive Quiz",
            "description": "Starten Sie Ihr Quiz und passen Sie die Schwierigkeit im laufenden Betrieb an. Verfeinern Sie Themen, ändern Sie die Komplexität und lernen Sie in Ihrem eigenen Tempo. Jede Frage wird basierend auf Ihren tatsächlichen Lernmaterialien generiert."
          },
          {
            "number": 3,
            "title": "Lernen Sie mit KI-Nachhilfe",
            "description": "Stecken Sie bei einer Frage fest? Starten Sie eine Konversation mit Ihrem KI-Tutor. Erhalten Sie detaillierte Erklärungen, erforschen Sie verwandte Konzepte und verstehen Sie das Material wirklich - nicht nur Antworten auswendig lernen."
          },
          {
            "number": 4,
            "title": "Wachsen Sie Mit der Zeit",
            "description": "QuizBee lernt von Ihrer Reise. Mit Ihrem Fortschritt identifiziert es Ihre schwachen Punkte und Wissenslücken und passt zukünftige Fragen an, um sich auf Bereiche zu konzentrieren, die Verbesserung benötigen. Bauen Sie durch kontinuierliche, personalisierte Verstärkung dauerhafte Beherrschung auf."
          }
        ]
      }
    },
    {
      "type": "FAQ",
      "props": {
        "title": "Häufig Gestellte Fragen",
        "subtitle": "Fragen?",
        "theme": "",
        "questions": [
          {
            "question": "Gibt es eine kostenlose Stufe?",
            "answer": "Ja. Wir bieten eine kostenlose Stufe mit begrenzten Funktionen, um Ihnen den Einstieg zu erleichtern. Wenn Sie die Plus- oder Pro-Stufen testen möchten, können Sie immer eine Rückerstattung innerhalb von 14 Tagen nach dem Kauf erhalten."
          },
          {
            "question": "Wie werden meine Zahlungsinformationen behandelt?",
            "answer": "Ihre Kreditkarteninformationen werden vollständig von Stripe verarbeitet, einer hochzuverlässigen und sicheren Zahlungsplattform. Wir haben nie Zugriff auf Ihre Kartendetails."
          },
          {
            "question": "Welche Dateiformate unterstützen Sie?",
            "answer": "Wir unterstützen PDF, DOCX, PPTX, Markdown, TXT und mehr. Sie können Vorlesungsnotizen, Lehrbücher, Lernratgeber, Artikel - praktisch alle textbasierten Lernmaterialien hochladen."
          },
          {
            "question": "Wie funktioniert der KI-Tutor?",
            "answer": "Nach jeder Quiz-Frage können Sie mit unserem KI-Tutor ein Gespräch starten. Er hat vollständigen Kontext Ihrer Lernmaterialien und kann Konzepte erklären, Beispiele geben, verwirrendende Themen klären und Follow-up-Fragen beantworten - alles auf Basis IHRER spezifischen Materialien."
          },
          {
            "question": "Sind meine Daten sicher und privat?",
            "answer": "Absolut. Ihre Lernmaterialien und Quiz-Geschichte sind mit AES-256 verschlüsselt und sicher gespeichert. Als europaisches Unternehmen befolgen wir strikt die GDPR. Wir teilen Ihre Daten nie für nicht autorisierte Verwendung - Sie besitzen sie und können sie jederzeit löschen."
          },
          {
            "question": "Kann ich mein Abonnement jederzeit kündigen?",
            "answer": "Ja! Keine langfristigen Verträge oder Verpflichtungen. Kündigen Sie mit einem Klick aus Ihren Kontoeinstellungen. Sie behalten Zugriff bis zum Ende Ihres Abrechnungszeitraums und wir bieten eine 14-tägige Geld-zurück-Garantie."
          }
        ]
      }
    },
    {
      "type": "CTA",
      "props": {
        "headline": "Bereit, Ihr Lernen zu Transformieren?",
        "subheadline": "Schließen Sie sich Hunderten von Schülern an, die mit KI-gestützten Quiz intelligenter studieren. Laden Sie Ihr erstes Material hoch und erstellen Sie in Sekunden ein Quiz. Keine Kreditkarte erforderlich.",
        "buttonText": "Kostenlos Starten - Keine Kreditkarte Erforderlich",
        "buttonHref": "{{APP_URL}}",
        "theme": ""
      }
    }
  ]
}
