{
  "locale": "es",
  "slug": "quizbee-base",
  "meta": {
    "title": "QuizBee - Aprende de Manera Más Inteligente con Cuestionarios Impulsados por IA",
    "description": "Transforma tus materiales de estudio en cuestionarios interactivos impulsados por IA. Aprendizaje adaptativo, tutoría con IA y seguimiento de progreso para estudiantes y profesionales.",
    "image": "/bee_v3.svg",
    "active": "home",
    "headerCtaHref": "{{APP_URL}}",
    "structuredData": {
      "@context": "https://schema.org",
      "@type": "WebApplication",
      "name": "QuizBee",
      "description": "Plataforma de generación de cuestionarios impulsada por IA que transforma materiales de estudio en cuestionarios interactivos",
      "applicationCategory": "EducationalApplication",
      "offers": {
        "@type": "Offer",
        "price": "0",
        "priceCurrency": "USD"
      },
      "aggregateRating": {
        "@type": "AggregateRating",
        "ratingValue": "5",
        "ratingCount": "6",
        "reviewCount": "6"
      }
    }
  },
  "sections": [
    {
      "type": "Hero",
      "props": {
        "title": "Transforma Tus Materiales de Estudio en",
        "titleHighlight": "Cuestionarios Interactivos",
        "description": "Sube tus notas de clase, libros de texto o guías de estudio. QuizBee utiliza IA para generar cuestionarios personalizados que te ayudan a aprobar tus exámenes.",
        "buttonText": "Comenzar a crear cuestionarios",
        "footerText": "Gratis para empezar • Sin tarjeta de crédito requerida",
        "href": "{{APP_URL}}",
        "image": "",
        "titleAlign": "center",
        "descriptionAlign": "center",
        "footerAlign": "center",
        "position": "right",
        "center": true,
        "textWidth": "max-w-5xl",
        "titleSize": "text-7xl 2xl:text-8xl",
        "descriptionSize": "text-xl 2xl:text-2xl py-6",
        "buttonSize": "xl"
      }
    },
    {
      "type": "Pains",
      "props": {
        "title": "¿Cansado de Estudiar Sin Que Se Te Quede Nada?",
        "theme": "",
        "pains": [
          {
            "title": "Lees... y Olvidas",
            "description": "Pasas horas releyendo, pero cuando llega el examen, todo desaparece de tu memoria.",
            "icon": "book-open-text"
          },
          {
            "title": "Trabajo Duro, Resultados Inciertos",
            "description": "Estudias mucho, pero antes del examen no sabes qué repasar ni qué te has perdido.",
            "icon": "frown"
          },
          {
            "title": "Materiales por Todos Lados, Sin Estructura",
            "description": "Montones de PDFs, diapositivas de clase, notas, pero sin forma de convertirlos en algo útil para aprender de verdad.",
            "icon": "file-stack"
          },
          {
            "title": "Harto de Chats Infinitos con IA",
            "description": "¿Cansado de subir y re-explicar el mismo contenido una y otra vez a chats de IA?",
            "icon": "message-circle-x"
          }
        ]
      }
    },
    {
      "type": "Features",
      "props": {
        "title": "Funciones Potentes para un Aprendizaje Más Inteligente",
        "subtitle": "Lo Que Hace Especial a QuizBee",
        "theme": "default",
        "features": [
          {
            "title": "Cuestionarios Generados por IA",
            "description": "Sube tus materiales de estudio y obtén instantáneamente cuestionarios personalizados adaptados a tu contenido. PDFs, documentos, notas: manejamos todo.",
            "icon": "bot"
          },
          {
            "title": "Conversaciones con Tutor de IA",
            "description": "Después de cada pregunta puedes chatear con un tutor de IA que conoce tus materiales. Obtén explicaciones, aclaraciones e ideas más profundas al instante.",
            "icon": "message-circle"
          },
          {
            "title": "Ajuste Dinámico de Dificultad",
            "description": "Controla la dificultad en tiempo real mientras realizas los cuestionarios. ¿Demasiado fácil? Aumenta. ¿Demasiado difícil? Reduce. El cuestionario se adapta a tu ritmo de aprendizaje.",
            "icon": "sliders-horizontal"
          },
          {
            "title": "Refinamiento de Temas",
            "description": "Ajusta el enfoque de tu cuestionario a mitad de sesión. ¿Quieres profundizar en un tema específico? Solo pide, y el cuestionario se adapta.",
            "icon": "target"
          },
          {
            "title": "Seguimiento de Progreso",
            "description": "Monitorea tu rendimiento con el tiempo. Ve qué temas has dominado y cuáles necesitan más atención.",
            "icon": "trending-up"
          },
          {
            "title": "Comparte y Estudia Juntos",
            "description": "Comparte tus cuestionarios personalizados con amigos y compañeros. Estudien juntos, desafíense mutuamente y dominen sus materias en equipo.",
            "icon": "users"
          }
        ],
        "stats": {
          "total": "200+",
          "label": "Cuestionarios Generados Diariamente",
          "description": "Únete a cientos de estudiantes y profesionales que usan QuizBee para dominar sus materiales"
        }
      }
    },
    {
      "type": "HowItWorks",
      "props": {
        "title": "Comienza en 4 Simples Pasos",
        "subtitle": "Cómo Funciona QuizBee",
        "theme": "",
        "steps": [
          {
            "number": 1,
            "title": "Sube Tus Materiales",
            "description": "Coloca tus PDFs, documentos o notas en QuizBee. Nuestra IA analiza el contenido y se prepara para crear cuestionarios personalizados basados en tus materiales."
          },
          {
            "number": 2,
            "title": "Realiza Cuestionarios Adaptativos",
            "description": "Comienza tu cuestionario y ajusta la dificultad sobre la marcha. Refina temas, cambia la complejidad y aprende a tu propio ritmo. Cada pregunta se genera basándose en tus materiales de estudio reales."
          },
          {
            "number": 3,
            "title": "Aprende con Tutoría de IA",
            "description": "¿Atascado en una pregunta? Inicia una conversación con tu tutor de IA. Obtén explicaciones detalladas, explora conceptos relacionados y comprende verdaderamente el material, no solo memorices respuestas."
          },
          {
            "number": 4,
            "title": "Crece con el Tiempo",
            "description": "QuizBee aprende de tu viaje. A medida que progresas, identifica tus puntos débiles y lagunas de conocimiento, adaptando futuras preguntas para enfocarse en áreas que necesitan mejora. Construye dominio duradero a través del refuerzo continuo y personalizado."
          }
        ]
      }
    },
    {
      "type": "FAQ",
      "props": {
        "title": "Preguntas Frecuentes",
        "subtitle": "¿Tienes Preguntas?",
        "theme": "",
        "questions": [
          {
            "question": "¿Hay un nivel gratuito?",
            "answer": "Sí. Ofrecemos un nivel gratuito con funciones limitadas para ayudarte a comenzar. Si quieres probar los niveles Plus o Pro, siempre puedes obtener un reembolso dentro de 14 días de la compra."
          },
          {
            "question": "¿Cómo se maneja mi información de pago?",
            "answer": "Tu información de tarjeta de crédito se procesa completamente a través de Stripe, una plataforma de pago altamente confiable y segura. Nunca tenemos acceso a los detalles de tu tarjeta en ningún momento."
          },
          {
            "question": "¿Qué formatos de archivo admiten?",
            "answer": "Admitimos PDF, DOCX, PPTX, Markdown, TXT y más. Puedes subir notas de clase, libros de texto, guías de estudio, artículos, prácticamente cualquier material de estudio basado en texto."
          },
          {
            "question": "¿Cómo funciona el tutor de IA?",
            "answer": "Después de cada pregunta del cuestionario, puedes iniciar una conversación con nuestro tutor de IA. Tiene contexto completo de tus materiales de estudio y puede explicar conceptos, proporcionar ejemplos, aclarar temas confusos y responder preguntas de seguimiento, todo basado en TUS materiales específicos."
          },
          {
            "question": "¿Son mis datos seguros y privados?",
            "answer": "Absolutamente. Tus materiales de estudio e historial de cuestionarios están encriptados con AES-256 y almacenados de forma segura. Como empresa con sede en Europa, seguimos estrictamente la GDPR. Nunca compartimos tus datos para usos no autorizados, los datos te pertenecen y puedes eliminarlos en cualquier momento."
          },
          {
            "question": "¿Puedo cancelar mi suscripción en cualquier momento?",
            "answer": "¡Sí! Sin contratos a largo plazo ni compromisos. Cancela con un clic desde la configuración de tu cuenta. Mantendrás acceso hasta el final de tu período de facturación, y ofrecemos una garantía de devolución de dinero de 14 días."
          }
        ]
      }
    },
    {
      "type": "CTA",
      "props": {
        "headline": "¿Listo para Transformar Tu Aprendizaje?",
        "subheadline": "Únete a cientos de estudiantes que estudian de manera más inteligente con cuestionarios impulsados por IA. Sube tu primer material y crea un cuestionario en segundos. No se requiere tarjeta de crédito.",
        "buttonText": "Comenzar Gratis - Sin Tarjeta de Crédito Requerida",
        "buttonHref": "{{APP_URL}}",
        "theme": ""
      }
    }
  ]
}
